,category,message
2574,spam,Get your garden ready for summer with a FREE selection of summer bulbs and seeds worth £33:50 only with The Scotsman this Saturday. To stop go2 notxt.co.uk
2595,spam,ree entry in 2 a weekly comp for a chance to win an ipod. Txt POD to 80182 to get entry (std txt rate) T&C's apply 08452810073 for details 18+
2601,spam,"YOU VE WON! Your 4* Costa Del Sol Holiday or £5000 await collection. Call 09050090044 Now toClaim. SAE, TC s, POBox334, Stockport, SK38xh, Cost£1.50/pm, Max10mins"
2603,spam,Had your mobile 11mths ? Update for FREE to Oranges latest colour camera mobiles & unlimited weekend calls. Call Mobile Upd8 on freefone 08000839402 or 2StopTxt
2619,spam,Someonone you know is trying to contact you via our dating service! To find out who it could be call from your mobile or landline 09064015307 BOX334SK38ch 
2635,spam,"If you don't, your prize will go to another customer. T&C at www.t-c.biz 18+ 150p/min Polo Ltd Suite 373 London W1J 6HL Please call back if busy "
2643,spam,"URGENT! You have won a 1 week FREE membership in our £100,000 Prize Jackpot! Txt the word: CLAIM to No: 81010 T&C www.dbuk.net LCCLTD POBOX 4403LDNW1A7RW18"
2683,spam,Camera - You are awarded a SiPix Digital Camera! call 09061221066 fromm landline. Delivery within 28 days.
2689,spam,The current leading bid is 151. To pause this auction send OUT. Customer Care: 08718726270
2691,spam,You have 1 new message. Call 0207-083-6089
2714,spam,Santa Calling! Would your little ones like a call from Santa Xmas eve? Call 09058094583 to book your time.
2722,spam,You have won a guaranteed 32000 award or maybe even £1000 cash to claim ur award call free on 0800 ..... (18+). Its a legitimat efreefone number wat do u think???
2725,spam,"Latest News! Police station toilet stolen, cops have nothing to go on!"
2734,spam,Get your garden ready for summer with a FREE selection of summer bulbs and seeds worth £33:50 only with The Scotsman this Saturday. To stop go2 notxt.co.uk
2744,spam,2p per min to call Germany 08448350055 from your BT line. Just 2p per min. Check PlanetTalkInstant.com for info & T's & C's. Text stop to opt out
2749,spam,"SMS SERVICES. for your inclusive text credits, pls goto www.comuk.net login= 3qxj9 unsubscribe with STOP, no extra charge. help 08702840625.COMUK. 220-CM2 9AE"
2751,spam,PRIVATE! Your 2003 Account Statement for 07808247860 shows 800 un-redeemed S. I. M. points. Call 08719899229 Identifier Code: 40411 Expires 06/11/04
2769,spam,Want explicit SEX in 30 secs? Ring 02073162414 now! Costs 20p/min Gsex POBOX 2667 WC1N 3XX
2774,spam,"Had your contract mobile 11 Mnths? Latest Motorola, Nokia etc. all FREE! Double Mins & Text on Orange tariffs. TEXT YES for callback, no to remove from records."
2784,spam,"This is the 2nd time we have tried 2 contact u. U have won the £750 Pound prize. 2 claim is easy, call 087187272008 NOW1! Only 10p per minute. BT-national-rate."
0,ham,Ok lar... Joking wif u oni...
1,ham,U dun say so early hor... U c already then say...
2,ham,As per your request 'Melle Melle (Oru Minnaminunginte Nurungu Vettam)' has been set as your callertune for all Callers. Press *9 to copy your friends Callertune
3,ham,I've been searching for the right words to thank you for this breather. I promise i wont take your help for granted and will fulfil my promise. You have been wonderful and a blessing at all times.
4,ham,Eh u remember how 2 spell his name... Yes i did. He v naughty make until i v wet.
5,ham,I‘m going to try for 2 months ha ha only joking
6,ham,Aft i finish my lunch then i go str down lor. Ard 3 smth lor. U finish ur lunch already?
7,ham,Just forced myself to eat a slice. I'm really not hungry tho. This sucks. Mark is getting worried. He knows I'm sick when I turn down pizza. Lol
8,ham,Did you catch the bus ? Are you frying an egg ? Did you make a tea? Are you eating your mom's left over dinner ? Do you feel my Love ?
9,ham,Ahhh. Work. I vaguely remember that! What does it feel like? Lol
10,ham,Yeah he got in at 2 and was v apologetic. n had fallen out and she was actin like spoilt child and he got caught up in that. Till 2! But we won't go there! Not doing too badly cheers. You? 
11,ham,For fear of fainting with the of all that housework you just did? Quick have a cuppa
12,ham,Yup... Ok i go home look at the timings then i msg ü again... Xuhui going to learn on 2nd may too but her lesson is at 8am
13,ham,I see the letter B on my car
14,ham,Hello! How's you and how did saturday go? I was just texting to see if you'd decided to do anything tomo. Not that i'm trying to invite myself or anything!
15,ham,"Did I forget to tell you ? I want you , I need you, I crave you ... But most of all ... I love you my sweet Arabian steed ... Mmmmmm ... Yummy"
16,ham,WHO ARE YOU SEEING?
17,ham,No calls..messages..missed calls
18,ham,"Fair enough, anything going on?"
19,ham,U don't know how stubborn I am. I didn't even want to go to the hospital. I kept telling Mark I'm not a weak sucker. Hospitals are for weak suckers.
20,ham,"A gram usually runs like  &lt;#&gt; , a half eighth is smarter though and gets you almost a whole second gram for  &lt;#&gt;"
21,ham,"Wow. I never realized that you were so embarassed by your accomodations. I thought you liked it, since i was doing the best i could and you always seemed so happy about ""the cave"". I'm sorry I didn't and don't have more to give. I'm sorry i offered. I'm sorry your room was so embarassing."
22,ham,Do you know what Mallika Sherawat did yesterday? Find out now @  &lt;URL&gt;
23,ham,"Sorry, I'll call later in meeting."
24,ham,Yes..gauti and sehwag out of odi series.
25,ham,Ha ha ha good joke. Girls are situation seekers.
26,ham,"Sorry my roommates took forever, it ok if I come by now?"
27,ham,I plane to give on this month end.
28,ham,Finished class where are you.
29,ham,K..k:)where are you?how did you performed?
30,ham,I am waiting machan. Call me once you free.
31,ham,I like you peoples very much:) but am very shy pa.
32,ham,Its not the same here. Still looking for a job. How much do Ta's earn there.
33,ham,K. Did you call me just now ah? 
34,ham,You will be in the place of that man
35,ham,"I call you later, don't have network. If urgnt, sms me."
36,ham,Yes I started to send requests to make it but pain came back so I'm back in bed. Double coins at the factory too. I gotta cash in all my nitros.
37,ham,"Ela kano.,il download, come wen ur free.."
38,ham,Sorry to be a pain. Is it ok if we meet another night? I spent late afternoon in casualty and that means i haven't done any of y stuff42moro and that includes all my time sheets and that. Sorry. 
39,ham,i see. When we finish we have loads of loans to pay
40,ham,I see a cup of coffee animation
41,ham,Okay name ur price as long as its legal! Wen can I pick them up? Y u ave x ams xx
42,ham,As per your request 'Melle Melle (Oru Minnaminunginte Nurungu Vettam)' has been set as your callertune for all Callers. Press *9 to copy your friends Callertune
43,ham,Umma my life and vava umma love you lot dear
44,ham,"Aight, I'll hit you up when I get some cash"
45,ham,I know! Grumpy old people. My mom was like you better not be lying. Then again I am always the one to play jokes...
46,ham,What is the plural of the noun research?
47,ham,I'm ok wif it cos i like 2 try new things. But i scared u dun like mah. Cos u said not too loud.
48,ham,"Wa, ur openin sentence very formal... Anyway, i'm fine too, juz tt i'm eatin too much n puttin on weight...Haha... So anythin special happened?"
49,ham,Hmm...my uncle just informed me that he's paying the school directly. So pls buy food.
50,ham,Ü predict wat time ü'll finish buying?
51,ham,"Just so that you know,yetunde hasn't sent money yet. I just sent her a text not to bother sending. So its over, you dont have to involve yourself in anything. I shouldn't have imposed anything on you in the first place so for that, i apologise."
52,ham,HEY GIRL. HOW R U? HOPE U R WELL ME AN DEL R BAK! AGAIN LONG TIME NO C! GIVE ME A CALL SUM TIME FROM LUCYxx
53,ham,I'm home.
54,ham,First answer my question.
55,ham,He is there. You call and meet him
56,ham,"K, text me when you're on the way"
57,ham,"A swt thought: ""Nver get tired of doing little things 4 lovable persons.."" Coz..somtimes those little things occupy d biggest part in their Hearts.. Gud ni8"
58,ham,Yes see ya not on the dot
59,ham,K..i deleted my contact that why?
60,ham,The wine is flowing and i'm i have nevering..
61,ham,Ok... Ur typical reply...
62,ham,"You are everywhere dirt, on the floor, the windows, even on my shirt. And sometimes when i open my mouth, you are all that comes flowing out. I dream of my world without you, then half my chores are out too. A time of joy for me, lots of tv shows i.ll see. But i guess like all things you just must exist, like rain, hail and mist, and when my time here is done, you and i become one."
63,ham,I'm leaving my house now...
64,ham,Keep yourself safe for me because I need you and I miss you already and I envy everyone that see's you in real life
65,ham,I'm so in love with you. I'm excited each day i spend with you. You make me so happy.
66,ham,Great escape. I fancy the bridge but needs her lager. See you tomo 
67,ham,"Sir, I need AXIS BANK account no and bank address."
68,ham,What time you coming down later? 
69,ham,"Well, i'm gonna finish my bath now. Have a good...fine night."
70,ham,U still going to the mall?
71,ham,Text her. If she doesnt reply let me know so i can have her log in
72,ham,You lifted my hopes with the offer of money. I am in need. Especially when the end of the month approaches and it hurts my studying. Anyways have a gr8 weekend
73,ham,ok. I am a gentleman and will treat you with dignity and respect.
74,ham,Going on nothing great.bye
75,ham,"Haha awesome, be there in a minute"
76,ham,Have you got Xmas radio times. If not i will get it now
77,ham,Hi :)finally i completed the course:)
78,ham,How are you doing? Hope you've settled in for the new school year. Just wishin you a gr8 day
79,ham,Did u got that persons story
80,ham,Hi its Kate how is your evening? I hope i can see you tomorrow for a bit but i have to bloody babyjontet! Txt back if u can. :) xxx
81,ham,I sent you  &lt;#&gt;  bucks
82,ham,Your account has been refilled successfully by INR  &lt;DECIMAL&gt; . Your KeralaCircle prepaid account balance is Rs  &lt;DECIMAL&gt; . Your Transaction ID is KR &lt;#&gt; .
83,ham,U call me alter at 11 ok.
84,ham,"As I entered my cabin my PA said, '' Happy B'day Boss !!''. I felt special. She askd me 4 lunch. After lunch she invited me to her apartment. We went there."
85,ham,You please give us connection today itself before  &lt;DECIMAL&gt;  or refund the bill
86,ham,"What's up bruv, hope you had a great break. Do have a rewarding semester."
87,ham,K:)k:)good:)study well.
88,ham,Sounds great! Are you home now?
89,ham,Tired. I haven't slept well the past few nights.
90,ham,I have to take exam with march 3
91,ham,Ok no prob. Take ur time.
92,ham,"Sorry, I'll call later"
93,ham,"Life is more strict than teacher... Bcoz Teacher teaches lesson &amp; then conducts exam, But Life first conducts Exam &amp; then teaches Lessons. Happy morning. . ."
94,ham,Get down in gandhipuram and walk to cross cut road. Right side &lt;#&gt; street road and turn at first right.
95,ham,"Sorry battery died, yeah I'm here"
96,ham,Or ill be a little closer like at the bus stop on the same street
97,ham,"New Theory: Argument wins d SITUATION, but loses the PERSON. So dont argue with ur friends just.. . . . kick them &amp; say, I'm always correct.!"
98,ham,Tomarrow final hearing on my laptop case so i cant.
99,ham,"Okay. No no, just shining on. That was meant to be signing, but that sounds better."
100,ham,U don't remember that old commercial?
101,ham,I asked you to call him now ok
102,ham,It didnt work again oh. Ok goodnight then. I.ll fix and have it ready by the time you wake up. You are very dearly missed have a good night sleep.
103,ham,Ranjith cal drpd Deeraj and deepak 5min hold
104,ham,What you doing?how are you?
105,ham,"I'm back, lemme know when you're ready"
106,ham,Mmm so yummy babe ... Nice jolt to the suzy
107,ham,Yup
108,ham,MY NO. IN LUTON 0125698789 RING ME IF UR AROUND! H*
109,ham,Why you Dint come with us.
110,ham,"Not sure yet, still trying to get a hold of him"
111,ham,The evo. I just had to download flash. Jealous?
112,ham,"Come to mu, we're sorting out our narcotics situation"
113,ham,No objection. My bf not coming.
114,ham,Tell rob to mack his gf in the theater
115,ham,Just sent it. So what type of food do you like?
116,ham,You got called a tool?
117,ham,Ok. I asked for money how far
118,ham,"Yeah I think my usual guy's still passed out from last night, if you get ahold of anybody let me know and I'll throw down"
119,ham,Ok..
120,ham,"My life Means a lot to me, Not because I love my life, But because I love the people in my life, The world calls them friends, I call them my World:-).. Ge:-).."
121,ham,Hey you told your name to gautham ah?
122,ham,Oops. 4 got that bit.
123,ham,I accidentally deleted the message. Resend please.
124,ham,Unless it's a situation where YOU GO GURL would be more appropriate
125,ham,I cant pick the phone right now. Pls send a message
126,ham,"Awesome, I remember the last time we got somebody high for the first time with diesel :V"
127,ham,Oh and by the way you do have more food in your fridge! Want to go out for a meal tonight? 
128,ham,Jos ask if u wana meet up?
129,ham,Today is ACCEPT DAY..U Accept me as? Brother Sister Lover Dear1 Best1 Clos1 Lvblefrnd Jstfrnd Cutefrnd Lifpartnr Belovd Swtheart Bstfrnd No rply means enemy
130,ham,He says he'll give me a call when his friend's got the money but that he's definitely buying before the end of the week
131,ham,You made my day. Do have a great day too.
132,ham,"Hmmm... Guess we can go 4 kb n power yoga... Haha, dunno we can tahan power yoga anot... Thk got lo oso, forgot liao..."
133,ham,"Merry Christmas to you too babe, i love ya *kisses*"
134,ham,cud u tell ppl im gona b a bit l8 cos 2 buses hav gon past cos they were full & im still waitin 4 1. Pete x
135,ham,No problem. How are you doing?
136,ham,Hi da:)how is the todays class?
137,ham,"Cool, text me when you're parked"
138,ham,K.k:)apo k.good movie.
139,ham,Cool. So how come you havent been wined and dined before?
140,ham,"Sorry, I'll call later"
141,ham,Ok that's great thanx a lot.
142,ham,Where u been hiding stranger?
143,ham,My sister cleared two round in birla soft yesterday.
144,ham,Dis is yijue. I jus saw ur mail. In case huiming havent sent u my num. Dis is my num.
145,ham,"Nah can't help you there, I've never had an iphone"
146,ham,"TODAY is Sorry day.! If ever i was angry with you, if ever i misbehaved or hurt you? plz plz JUST SLAP URSELF Bcoz, Its ur fault, I'm basically GOOD"
147,ham,&lt;#&gt; ISH MINUTES WAS 5 MINUTES AGO. WTF.
148,ham,"I'm an actor. When i work, i work in the evening and sleep late. Since i'm unemployed at the moment, i ALWAYS sleep late. When you're unemployed, every day is saturday."
149,ham,Ha ha cool cool chikku chikku:-):-DB-)
150,ham,Check audrey's status right now
151,ham,"Good afternoon sunshine! How dawns that day ? Are we refreshed and happy to be alive? Do we breathe in the air and smile ? I think of you, my love ... As always"
152,ham,Wat uniform? In where get?
153,ham,"Hello my boytoy ... Geeee I miss you already and I just woke up. I wish you were here in bed with me, cuddling me. I love you ..."
154,ham,I'm going for bath will msg you next  &lt;#&gt;  min..
155,ham,You could have seen me..i did't recognise you Face.:)
156,ham,Keep my payasam there if rinu brings
157,ham,"I guess that's why you re worried. You must know that there's a way the body repairs itself. And i'm quite sure you shouldn't worry. We'll take it slow. First the tests, they will guide when your ovulation is then just relax. Nothing you've said is a reason to worry but i.ll keep on followin you up."
158,ham,Hey leave it. not a big deal:-) take care.
159,ham,Customer place i will call you.
160,ham,Huh so late... Fr dinner?
161,ham,Morning only i can ok.
162,ham,Pick you up bout 7.30ish? What time are  and that going?
163,ham,Was actually sleeping and still might when u call back. So a text is gr8. You rock sis. Will send u a text wen i wake.
164,ham,"Good evening Sir, Al Salam Wahleykkum.sharing a happy news.By the grace of God, i got an offer from Tayseer,TISSCO and i joined.Hope you are fine.Inshah Allah,meet you sometime.Rakhesh,visitor from India."
165,ham,The hair cream has not been shipped.
166,ham,"Yep, the great loxahatchee xmas tree burning of  &lt;#&gt;  starts in an hour"
167,ham,All was well until slightly disastrous class this pm with my fav darlings! Hope day off ok. Coffee wld be good as can't stay late tomorrow. Same time + place as always?
168,ham,Headin towards busetop
169,ham,Come by our room at some point so we can iron out the plan for this weekend
170,ham,"Okies... I'll go yan jiu too... We can skip ard oso, go cine den go mrt one, blah blah blah... "
171,ham,Alright i have a new goal now
172,ham,"Alright, I'll head out in a few minutes, text me where to meet you"
173,ham,Yes:)from last week itself i'm taking live call.
174,ham,Siva is in hostel aha:-.
175,ham,Send this to ur friends and receive something about ur voice..... How is my speaking expression? 1.childish 2.naughty 3.Sentiment 4.rowdy 5.ful of attitude 6.romantic 7.shy 8.Attractive 9.funny  &lt;#&gt; .irritating  &lt;#&gt; .lovable. reply me..
176,ham,aathi..where are you dear..
177,ham,7 at esplanade.. Do ü mind giving me a lift cos i got no car today..
178,ham,At home watching tv lor.
179,ham,You available now? I'm like right around hillsborough &amp;  &lt;#&gt; th
180,ham,"Ask g or iouri, I've told the story like ten times already"
181,ham,"Hi hope u get this txt~journey hasnt been gd,now about 50 mins late I think."
182,ham,Yes..he is really great..bhaji told kallis best cricketer after sachin in world:).very tough to get out.
183,ham,Oic... I saw him too but i tot he din c me... I found a group liao...
184,ham,"""HEY HEY WERETHE MONKEESPEOPLE SAY WE MONKEYAROUND! HOWDY GORGEOUS, HOWU DOIN? FOUNDURSELF A JOBYET SAUSAGE?LOVE JEN XXX"""
185,ham,"Well done, blimey, exercise, yeah, i kinda remember wot that is, hmm. "
186,ham,LOL ... Have you made plans for new years?
187,ham,hanks lotsly!
188,ham,K:)k:)what are detail you want to transfer?acc no enough?
189,ham,"LOOK AT AMY URE A BEAUTIFUL, INTELLIGENT WOMAN AND I LIKE U A LOT. I KNOW U DONT LIKE ME LIKE THAT SO DONT WORRY."
190,ham,"1.20 that call cost. Which i guess isnt bad. Miss ya, need ya, want ya, love ya"
191,ham,Where did u go? My phone is gonna die you have to stay in here
192,ham,Ok i am on the way to railway
193,ham,They don't put that stuff on the roads to keep it from getting slippery over there?
194,ham,"Yup, no need. I'll jus wait 4 e rain 2 stop."
195,ham,"Nothing. I meant that once the money enters your account here, the bank will remove its flat rate. Someone transfered  &lt;#&gt;  to my account and  &lt;#&gt; dollars got removed. So the banks differ and charges also differ.be sure you trust the 9ja person you are sending account details to cos..."
196,ham,Nice line said by a broken heart- Plz don't cum 1 more times infront of me... Other wise once again I ll trust U... Good 9t:)
197,ham,Love you aathi..love u lot..
198,ham,"K, can I pick up another 8th when you're done?"
199,ham,"Almost there, see u in a sec"
200,ham,Watching tv lor...
201,ham,You should change your fb to jaykwon thuglyfe falconerf
202,ham,"Depends on quality. If you want the type i sent boye, faded glory, then about 6. If you want ralphs maybe 2"
203,ham,"Sorry man my account's dry or I would, if you want we could trade back half or I could buy some shit with my credit card"
204,ham,"Sorry,in meeting I'll call later"
205,ham,Are you free now?can i call now?
206,ham,Nope... Think i will go for it on monday... Sorry i replied so late
207,ham,"Kate jackson rec center before 7ish, right?"
208,ham,"Fighting with the world is easy, u either win or lose bt fightng with some1 who is close to u is dificult if u lose - u lose if u win - u still lose."
209,ham,Check with nuerologist.
210,ham,"Maybe westshore or hyde park village, the place near my house?"
211,ham,What's the significance?
212,ham,"8 at the latest, g's still there if you can scrounge up some ammo and want to give the new ak a try"
213,ham,Lol ok your forgiven :)
214,ham,"That way transport is less problematic than on sat night. By the way, if u want to ask  n  to join my bday, feel free. But need to know definite nos as booking on fri. "
215,ham,But that's on ebay it might be less elsewhere.
216,ham,Were gonna go get some tacos
217,ham,Gudnite....tc...practice going on
218,ham,"I've not called you in a while. This is hoping it was l8r malaria and that you know that we miss you guys. I miss Bani big, so pls give her my love especially. Have a great day."
219,ham,"Probably gonna be here for a while, see you later tonight &lt;)"
220,ham,Ummmmmaah Many many happy returns of d day my dear sweet heart.. HAPPY BIRTHDAY dear
221,ham,But am going to college pa. What to do. are else ill come there it self. Pa.
222,ham,This girl does not stay in bed. This girl doesn't need recovery time. Id rather pass out while having fun then be cooped up in bed
223,ham,I know but you need to get hotel now. I just got my invitation but i had to apologise. Cali is to sweet for me to come to some english bloke's weddin
224,ham,Wait  &lt;#&gt;  min..
225,ham,"Imagine you finally get to sink into that bath after I have put you through your paces, maybe even having you eat me for a while before I left ... But also imagine the feel of that cage on your cock surrounded by the bath water, reminding you always who owns you ... Enjoy, my cuck"
226,ham,"Sure, if I get an acknowledgement from you that it's astoundingly tactless and generally faggy to demand a blood oath fo"
227,ham,I‘ll have a look at the frying pan in case it‘s cheap or a book perhaps. No that‘s silly a frying pan isn‘t likely to be a book
228,ham,Having lunch:)you are not in online?why?
229,ham,Hi Princess! Thank you for the pics. You are very pretty. How are you?
230,ham,Hi msg me:)i'm in office..
231,ham,Geeeee ... I love you so much I can barely stand it
232,ham,"Fuck babe ... I miss you already, you know ? Can't you let me send you some money towards your net ? I need you ... I want you ... I crave you ..."
233,ham,Oooh bed ridden ey? What are YOU thinking of?
234,ham,Love it! Daddy will make you scream with pleasure! I am going to slap your ass with my dick!
235,ham,Yar lor wait 4 my mum 2 finish sch then have lunch lor... I whole morning stay at home clean my room now my room quite clean... Hee...
236,ham,Can you open the door?
237,ham,Nope i waiting in sch 4 daddy... 
238,ham,"I'm tired of arguing with you about this week after week. Do what you want and from now on, i'll do the same."
239,ham,Huh so early.. Then ü having dinner outside izzit?
240,ham,So how's scotland. Hope you are not over showing your JJC tendencies. Take care. Live the dream
241,ham,"I dun thk i'll quit yet... Hmmm, can go jazz ? Yogasana oso can... We can go meet em after our lessons den... "
242,ham,Ya srsly better than yi tho
243,ham,"I met you as a stranger and choose you as my friend. As long as the world stands, our friendship never ends. Lets be Friends forever!!! Gud nitz..."
244,ham,Gud mrng dear have a nice day
245,ham,Will do. Was exhausted on train this morning. Too much wine and pie. You sleep well too
246,ham,Mind blastin.. No more Tsunamis will occur from now on.. Rajnikant stopped swimming in Indian Ocean..:-D
247,ham,Speaking of does he have any cash yet?
248,ham,Meet after lunch la...
249,ham,Neva mind it's ok..
250,ham,I have many dependents
251,ham,I called and said all to him:)then he have to choose this future.
252,ham,He like not v shock leh. Cos telling shuhui is like telling leona also. Like dat almost all know liao. He got ask me abt ur reaction lor.
253,ham,I come n pick ü up... Come out immediately aft ur lesson...
254,ham,Dear we got  &lt;#&gt;  dollars hi hi
255,ham,MAKE SURE ALEX KNOWS HIS BIRTHDAY IS OVER IN FIFTEEN MINUTES AS FAR AS YOU'RE CONCERNED
256,ham,"Nah it's straight, if you can just bring bud or drinks or something that's actually a little more useful than straight cash"
257,ham,How many licks does it take to get to the center of a tootsie pop?
258,ham,Please dont say like that. Hi hi hi
259,ham,Oh that was a forwarded message. I thought you send that to me
260,ham,"Sweetheart, hope you are not having that kind of day! Have one with loads of reasons to smile. Biola"
261,ham,"What will we do in the shower, baby?"
262,ham,"Well imma definitely need to restock before thanksgiving, I'll let you know when I'm out"
263,ham,Probably gonna swing by in a wee bit
264,ham,Allo! We have braved the buses and taken on the trains and triumphed. I mean we‘re in b‘ham. Have a jolly good rest of week
265,ham,Do you mind if I ask what happened? You dont have to say if it is uncomfortable.
266,ham,No prob. I will send to your email.
267,ham,Thats cool! Sometimes slow and gentle. Sonetimes rough and hard :)
268,ham,"Wait, do you know if wesleys in town? I bet she does hella drugs!"
269,ham,Did u got that persons story
270,ham,"Sun cant come to earth but send luv as rays. cloud cant come to river but send luv as rain. I cant come to meet U, but can send my care as msg to U. Gud evng"
271,ham,"It doesnt make sense to take it there unless its free. If you need to know more, wikipedia.com"
272,ham,"Under the sea, there lays a rock. In the rock, there is an envelope. In the envelope, there is a paper. On the paper, there are 3 words... '"
273,ham,Sorry me going home first... Daddy come fetch ü later...
274,ham,Yes baby! We can study all the positions of the kama sutra ;)
