,category,message
1148,spam,<Forwarded from 21870000>Hi - this is your Mailbox Messaging SMS alert. You have 4 messages. You have 21 matches. Please call back on 09056242159 to retrieve your messages and matches
1154,spam,Moby Pub Quiz.Win a £100 High Street prize if u know who the new Duchess of Cornwall will be? Txt her first name to 82277.unsub STOP £1.50 008704050406 SP Arrow
1155,spam,You have won a Nokia 7250i. This is what you get when you win our FREE auction. To take part send Nokia to 86021 now. HG/Suite342/2Lands Row/W1JHL 16+ 
1156,spam,"tddnewsletter@emc1.co.uk (More games from TheDailyDraw) Dear Helen, Dozens of Free Games - with great prizesWith.."
1171,spam,Double your mins & txts on Orange or 1/2 price linerental - Motorola and SonyEricsson with B/Tooth FREE-Nokia FREE Call MobileUpd8 on 08000839402 or2optout/HV9D
1183,spam,Tone Club: Your subs has now expired 2 re-sub reply MONOC 4 monos or POLYC 4 polys 1 weekly @ 150p per week Txt STOP 2 stop This msg free Stream 0871212025016
1206,spam,I don't know u and u don't know me. Send CHAT to 86688 now and let's find each other! Only 150p/Msg rcvd. HG/Suite342/2Lands/Row/W1J6HL LDN. 18 years or over.
1213,spam,Valentines Day Special! Win over £1000 in our quiz and take your partner on the trip of a lifetime! Send GO to 83600 now. 150p/msg rcvd. CustCare:08718720201
1236,spam,"Final Chance! Claim ur £150 worth of discount vouchers today! Text YES to 85023 now! SavaMob, member offers mobile! T Cs SavaMob POBOX84, M263UZ. £3.00 Subs 16"
1240,spam,"Urgent! call 09066612661 from landline. Your complementary 4* Tenerife Holiday or £10,000 cash await collection SAE T&Cs PO Box 3 WA14 2PX 150ppm 18+ Sender: Hol Offer"
1262,spam,FREE entry into our £250 weekly comp just send the word WIN to 80086 NOW. 18 T&C www.txttowin.co.uk
1287,spam,Your next amazing xxx PICSFREE1 video will be sent to you enjoy! If one vid is not enough for 2day text back the keyword PICSFREE1 to get the next video.
1290,spam,U are subscribed to the best Mobile Content Service in the UK for £3 per ten days until you send STOP to 83435. Helpline 08706091795.
1291,spam,"3 FREE TAROT TEXTS! Find out about your love life now! TRY 3 FOR FREE! Text CHANCE to 85555 16 only! After 3 Free, Msgs £1.50 each"
1331,spam,"Hello darling how are you today? I would love to have a chat, why dont you tell me what you look like and what you are in to sexy?"
1334,spam,Wanna get laid 2nite? Want real Dogging locations sent direct to ur mobile? Join the UK's largest Dogging Network. Txt PARK to 69696 now! Nyt. ec2a. 3lp £1.50/msg
1345,spam,sports fans - get the latest sports news str* 2 ur mobile 1 wk FREE PLUS a FREE TONE Txt SPORT ON to 8007 www.getzed.co.uk 0870141701216+ norm 4txt/120p 
1346,spam,"Urgent Urgent! We have 800 FREE flights to Europe to give away, call B4 10th Sept & take a friend 4 FREE. Call now to claim on 09050000555. BA128NNFWFLY150ppm"
1349,spam,FROM 88066 LOST £12 HELP
1352,spam,FreeMsg: Fancy a flirt? Reply DATE now & join the UKs fastest growing mobile dating service. Msgs rcvd just 25p to optout txt stop to 83021. Reply DATE now!
1355,spam,Hope you enjoyed your new content. text stop to 61610 to unsubscribe. help:08712400602450p Provided by tones2you.co.uk
1359,spam,18 days to Euro2004 kickoff! U will be kept informed of all the latest news and results daily. Unsubscribe send GET EURO STOP to 83222.
1364,spam,Urgent Please call 09066612661 from landline. £5000 cash or a luxury 4* Canary Islands Holiday await collection. T&Cs SAE award. 20M12AQ. 150ppm. 16+ “
1383,spam,Married local women looking for discreet action now! 5 real matches instantly to your phone. Text MATCH to 69969 Msg cost 150p 2 stop txt stop BCMSFWC1N3XX
1389,spam,"For ur chance to win a £250 cash every wk TXT: ACTION to 80608. T's&C's www.movietrivia.tv custcare 08712405022, 1x150p/wk."
1395,spam,U’ve Bin Awarded £50 to Play 4 Instant Cash. Call 08715203028 To Claim. EVERY 9th Player Wins Min £50-£500. OptOut 08718727870
1410,spam,INTERFLORA - It's not too late to order Interflora flowers for christmas call 0800 505060 to place your order before Midnight tomorrow.
1411,spam,ROMCAPspam Everyone around should be responding well to your presence since you are so warm and outgoing. You are bringing in a real breath of sunshine.
1431,spam,Adult 18 Content Your video will be with you shortly
1435,spam,"YOUR CHANCE TO BE ON A REALITY FANTASY SHOW call now = 08707509020 Just 20p per min NTT Ltd, PO Box 1327 Croydon CR9 5WB 0870 is a national = rate call."
1439,spam,"Hey Boys. Want hot XXX pics sent direct 2 ur phone? Txt PORN to 69855, 24Hrs free and then just 50p per day. To stop text STOPBCM SF WC1N3XX"
1440,spam,"Last Chance! Claim ur £150 worth of discount vouchers today! Text SHOP to 85023 now! SavaMob, offers mobile! T Cs SavaMob POBOX84, M263UZ. £3.00 Sub. 16"
1448,spam,"pdate_Now - Double mins and 1000 txts on Orange tariffs. Latest Motorola, SonyEricsson & Nokia & Bluetooth FREE! Call MobileUpd8 on 08000839402 or call2optout/!YHL"
1457,spam,Sorry! U can not unsubscribe yet. THE MOB offer package has a min term of 54 weeks> pls resubmit request after expiry. Reply THEMOB HELP 4 more info
1470,spam,You have 1 new message. Please call 08712400200.
1472,spam,We currently have a message awaiting your collection. To collect your message just call 08718723815.
1479,spam,U have a secret admirer. REVEAL who thinks U R So special. Call 09065174042. To opt out Reply REVEAL STOP. 1.50 per msg recd. Cust care 07821230901
1482,spam,"Do you ever notice that when you're driving, anyone going slower than you is an idiot and everyone driving faster than you is a maniac?"
1493,spam,Reply to win £100 weekly! What professional sport does Tiger Woods play? Send STOP to 87239 to end service
1502,spam,"You've won tkts to the EURO2004 CUP FINAL or £800 CASH, to collect CALL 09058099801 b4190604, POBOX 7876150ppm"
1504,spam,"Loan for any purpose £500 - £75,000. Homeowners + Tenants welcome. Have you been previously refused? We can still help. Call Free 0800 1956669 or text back 'help'"
1529,spam,You are now unsubscribed all services. Get tons of sexy babes or hunks straight to your phone! go to http://gotbabes.co.uk. No subscriptions.
1533,spam,Get a brand new mobile phone by being an agent of The Mob! Plus loads more goodies! For more info just text MAT to 87021.
1555,spam,Good Luck! Draw takes place 28th Feb 06. Good Luck! For removal send STOP to 87239 customer services 08708034412
1561,spam,Free entry in 2 a weekly comp for a chance to win an ipod. Txt POD to 80182 to get entry (std txt rate) T&C's apply 08452810073 for details 18+
1570,spam,sexy sexy cum and text me im wet and warm and ready for some porn! u up for some fun? THIS MSG IS FREE RECD MSGS 150P INC VAT 2 CANCEL TEXT STOP
1576,spam,Hard LIVE 121 chat just 60p/min. Choose your girl and connect LIVE. Call 09094646899 now! Cheap Chat UK's biggest live service. VU BCM1896WC1N3XX
1577,spam,Not heard from U4 a while. Call 4 rude chat private line 01223585334 to cum. Wan 2C pics of me gettin shagged then text PIX to 8552. 2End send STOP 8552 SAM xxx
1583,spam,"HOT LIVE FANTASIES call now 08707509020 Just 20p per min NTT Ltd, PO Box 1327 Croydon CR9 5WB 0870..k"
1594,spam,"This is the 2nd time we have tried 2 contact u. U have won the 750 Pound prize. 2 claim is easy, call 08712101358 NOW! Only 10p per min. BT-national-rate"
1608,spam,URGENT! We are trying to contact U. Todays draw shows that you have won a £2000 prize GUARANTEED. Call 09066358361 from land line. Claim Y87. Valid 12hrs only
1614,spam,"SIX chances to win CASH! From 100 to 20,000 pounds txt> CSH11 and send to 87575. Cost 150p/day, 6days, 16+ TsandCs apply Reply HL 4 info"
1644,spam,"Someone U know has asked our dating service 2 contact you! Cant Guess who? CALL 09058097189 NOW all will be revealed. POBox 6, LS15HB 150p "
1649,spam,This message is free. Welcome to the new & improved Sex & Dogging club! To unsubscribe from this service reply STOP. msgs@150p 18 only
1692,spam,FREE MSG:We billed your mobile number by mistake from shortcode 83332.Please call 08081263000 to have charges refunded.This call will be free from a BT landline
1695,spam,Please CALL 08712402972 immediately as there is an urgent message waiting for you
1698,spam,URGENT! Your Mobile number has been awarded with a £2000 Bonus Caller Prize. Call 09058095201 from land line. Valid 12hrs only
1700,spam,"As a valued customer, I am pleased to advise you that following recent review of your Mob No. you are awarded with a £1500 Bonus Prize, call 09066364589"
1704,spam,Do you want a New Nokia 3510i colour phone DeliveredTomorrow? With 300 free minutes to any mobile + 100 free texts + Free Camcorder reply or call 08000930705
1709,spam,LIFE has never been this much fun and great until you came in. You made it truly special for me. I won't forget you! enjoy @ one gbp/sms
1710,spam,"As a valued customer, I am pleased to advise you that following recent review of your Mob No. you are awarded with a £1500 Bonus Prize, call 09066368470"
1711,spam,Freemsg: 1-month unlimited free calls! Activate SmartCall Txt: CALL to No: 68866. Subscriptn3gbp/wk unlimited calls Help: 08448714184 Stop?txt stop landlineonly
1712,spam,Am new 2 club & dont fink we met yet Will B gr8 2 C U Please leave msg 2day wiv ur area 09099726553 reply promised CARLIE x Calls£1/minMobsmore LKPOBOX177HP51FL
1716,spam,Camera - You are awarded a SiPix Digital Camera! call 09061221066 fromm landline. Delivery within 28 days.
1721,spam,Save money on wedding lingerie at www.bridal.petticoatdreams.co.uk Choose from a superb selection with national delivery. Brought to you by WeddingFriend
1731,spam,Bloomberg -Message center +447797706009 Why wait? Apply for your future http://careers. bloomberg.com
1741,spam,Do you want a NEW video phone750 anytime any network mins 150 text for only five pounds per week call 08000776320 now or reply for delivery tomorrow
1747,spam,"You are being contacted by our dating service by someone you know! To find out who it is, call from a land line 09050000878. PoBox45W2TG150P"
1750,spam,Dorothy@kiefer.com (Bank of Granite issues Strong-Buy) EXPLOSIVE PICK FOR OUR MEMBERS *****UP OVER 300% *********** Nasdaq Symbol CDGT That is a $5.00 per..
1764,spam,"You are a £1000 winner or Guaranteed Caller Prize, this is our Final attempt to contact you! To Claim Call 09071517866 Now! 150ppmPOBox10183BhamB64XE"
1785,spam,Customer Loyalty Offer:The NEW Nokia6650 Mobile from ONLY £10 at TXTAUCTION! Txt word: START to No: 81151 & get yours Now! 4T&Ctxt TC 150p/MTmsg
1792,spam,Hi 07734396839 IBH Customer Loyalty Offer: The NEW NOKIA6600 Mobile from ONLY £10 at TXTAUCTION!Txt word:START to No:81151 & get Yours Now!4T&
1793,spam,I am hot n horny and willing I live local to you - text a reply to hear strt back from me 150p per msg Netcollex LtdHelpDesk: 02085076972 reply Stop to end
1797,spam,Do you want a New Nokia 3510i Colour Phone Delivered Tomorrow? With 200 FREE minutes to any mobile + 100 FREE text + FREE camcorder Reply or Call 08000930705
1815,spam,Get the official ENGLAND poly ringtone or colour flag on yer mobile for tonights game! Text TONE or FLAG to 84199. Optout txt ENG STOP Box39822 W111WX £1.50
1819,spam,"Customer service announcement. We recently tried to make a delivery to you but were unable to do so, please call 07090298926 to re-schedule. Ref:9307622"
1837,spam,You have won a Nokia 7250i. This is what you get when you win our FREE auction. To take part send Nokia to 86021 now. HG/Suite342/2Lands Row/W1JHL 16+
1839,spam,Promotion Number: 8714714 - UR awarded a City Break and could WIN a £200 Summer Shopping spree every WK. Txt STORE to 88039 . SkilGme. TsCs087147403231Winawk!Age16 £1.50perWKsub
1854,spam,Free Top ringtone -sub to weekly ringtone-get 1st week free-send SUBPOLY to 81618-?3 per week-stop sms-08718727870
1862,spam,"Hi there, 2nights ur lucky night! Uve been invited 2 XCHAT, the Uks wildest chat! Txt CHAT to 86688 now! 150p/MsgrcvdHG/Suite342/2Lands/Row/W1J6HL LDN 18yrs"
1877,spam,Bloomberg -Message center +447797706009 Why wait? Apply for your future http://careers. bloomberg.com
1881,spam,FREE for 1st week! No1 Nokia tone 4 ur mob every week just txt NOKIA to 8007 Get txting and tell ur mates www.getzed.co.uk POBox 36504 W45WQ norm150p/tone 16+
1894,spam,"Want to funk up ur fone with a weekly new tone reply TONES2U 2 this text. www.ringtones.co.uk, the original n best. Tones 3GBP network operator rates apply"
1900,spam,We tried to contact you re your reply to our offer of a Video Handset? 750 anytime any networks mins? UNLIMITED TEXT? Camcorder? Reply or call 08000930705 NOW
1903,spam,URGENT! We are trying to contact you. Last weekends draw shows that you have won a £900 prize GUARANTEED. Call 09061701851. Claim code K61. Valid 12hours only
1909,spam,74355 XMAS iscoming & ur awarded either £500 CD gift vouchers & free entry 2 r £100 weekly draw txt MUSIC to 87066 TnC
1942,spam,A link to your picture has been sent. You can also use http://alto18.co.uk/wave/wave.asp?o=44345
1945,spam,"Double Mins & 1000 txts on Orange tariffs. Latest Motorola, SonyEricsson & Nokia with Bluetooth FREE! Call MobileUpd8 on 08000839402 or call2optout/HF8"
1946,spam,URGENT This is our 2nd attempt to contact U. Your £900 prize from YESTERDAY is still awaiting collection. To claim CALL NOW 09061702893. ACL03530150PM
1947,spam,Dear Dave this is your final notice to collect your 4* Tenerife Holiday or #5000 CASH award! Call 09061743806 from landline. TCs SAE Box326 CW25WX 150ppm
1948,spam,tells u 2 call 09066358152 to claim £5000 prize. U have 2 enter all ur mobile & personal details @ the prompts. Careful!
1952,spam,Your 2004 account for 07XXXXXXXXX shows 786 unredeemed points. To claim call 08719181259 Identifier code: XXXXX Expires 26.03.05
1956,spam,You have an important customer service announcement. Call FREEPHONE 0800 542 0825 now!
1960,spam,FREE>Ringtone! Reply REAL or POLY eg REAL1 1. PushButton 2. DontCha 3. BabyGoodbye 4. GoldDigger 5. WeBeBurnin 1st tone FREE and 6 more when u join for £3/wk
1981,spam,"You have been specially selected to receive a ""3000 award! Call 08712402050 BEFORE the lines close. Cost 10ppm. 16+. T&Cs apply. AG Promo"
1990,spam,ringtoneking 84484
1995,spam,(Bank of Granite issues Strong-Buy) EXPLOSIVE PICK FOR OUR MEMBERS *****UP OVER 300% *********** Nasdaq Symbol CDGT That is a $5.00 per..
1999,spam,We tried to call you re your reply to our sms for a video mobile 750 mins UNLIMITED TEXT free camcorder Reply or call now 08000930705 Del Thurs
2000,spam,"This is the 2nd time we have tried to contact u. U have won the £400 prize. 2 claim is easy, just call 087104711148 NOW! Only 10p per minute. BT-national-rate"
2005,spam,"Wan2 win a Meet+Greet with Westlife 4 U or a m8? They are currently on what tour? 1)Unbreakable, 2)Untamed, 3)Unkempt. Text 1,2 or 3 to 83049. Cost 50p +std text"
2023,spam,Win a £1000 cash prize or a prize worth £5000
2030,spam,"This weeks SavaMob member offers are now accessible. Just call 08709501522 for details! SavaMob, POBOX 139, LA3 2WU. Only £1.50/week. SavaMob - offers mobile!"
2034,spam,TBS/PERSOLVO. been chasing us since Sept for£38 definitely not paying now thanks to your information. We will ignore them. Kath. Manchester.
2036,spam,Loans for any purpose even if you have Bad Credit! Tenants Welcome. Call NoWorriesLoans.com on 08717111821
2038,spam,87077: Kick off a new season with 2wks FREE goals & news to ur mobile! Txt ur club name to 87077 eg VILLA to 87077
2045,spam,We tried to call you re your reply to our sms for a video mobile 750 mins UNLIMITED TEXT + free camcorder Reply of call 08000930705 Now
2063,spam,"SPJanuary Male Sale! Hot Gay chat now cheaper, call 08709222922. National rate from 1.5p/min cheap to 7.8p/min peak! To stop texts call 08712460324 (10p/min)"
2074,spam,Please call Amanda with regard to renewing or upgrading your current T-Mobile handset free of charge. Offer ends today. Tel 0845 021 3680 subject to T's and C's
2084,spam,Congrats! Nokia 3650 video camera phone is your Call 09066382422 Calls cost 150ppm Ave call 3mins vary from mobiles 16+ Close 300603 post BCM4284 Ldn WC1N3XX
2091,spam,"Urgent! Please call 0906346330. Your ABTA complimentary 4* Spanish Holiday or £10,000 cash await collection SAE T&Cs BOX 47 PO19 2EZ 150ppm 18+"
2099,spam,"Want to funk up ur fone with a weekly new tone reply TONES2U 2 this text. www.ringtones.co.uk, the original n best. Tones 3GBP network operator rates apply"
2106,spam,Missed call alert. These numbers called but left no message. 07008009200
2118,spam,"U can WIN £100 of Music Gift Vouchers every week starting NOW Txt the word DRAW to 87066 TsCs www.Idew.com SkillGame, 1Winaweek, age16. 150ppermessSubscription"
2121,spam,Show ur colours! Euro 2004 2-4-1 Offer! Get an England Flag & 3Lions tone on ur phone! Click on the following service message for info!
2124,spam,"accordingly. I repeat, just text the word ok on your mobile phone and send"
2140,spam,WINNER!! As a valued network customer you have been selected to receivea £900 prize reward! To claim call 09061701461. Claim code KL341. Valid 12 hours only.
2147,spam,Kit Strip - you have been billed 150p. Netcollex Ltd. PO Box 1013 IG11 OJA
2148,spam,Please CALL 08712402578 immediately as there is an urgent message waiting for you
2149,spam,"WELL DONE! Your 4* Costa Del Sol Holiday or £5000 await collection. Call 09050090044 Now toClaim. SAE, TCs, POBox334, Stockport, SK38xh, Cost£1.50/pm, Max10mins"
2155,spam,Someone U know has asked our dating service 2 contact you! Cant Guess who? CALL 09058091854 NOW all will be revealed. PO BOX385 M6 6WU
2164,spam,"Congrats! 2 mobile 3G Videophones R yours. call 09061744553 now! videochat wid ur mates, play java games, Dload polyH music, noline rentl. bx420. ip4. 5we. 150pm"
2177,spam,important information 4 orange user 0789xxxxxxx. today is your lucky day!2find out why log onto http://www.urawinner.com THERE'S A FANTASTIC SURPRISE AWAITING YOU!
2179,spam,"Our dating service has been asked 2 contact U by someone shy! CALL 09058091870 NOW all will be revealed. POBox84, M26 3UZ 150p"
2185,spam,Do you want a new Video handset? 750 any time any network mins? UNLIMITED TEXT? Camcorder? Reply or Call now 08000930705 for del Sat AM
2186,spam,"Ur balance is now £600. Next question: Complete the landmark, Big, A. Bob, B. Barry or C. Ben ?. Text A, B or C to 83738. Good luck!"
2188,spam,"If you don't, your prize will go to another customer. T&C at www.t-c.biz 18+ 150p/min Polo Ltd Suite 373 London W1J 6HL Please call back if busy"
2203,spam,As one of our registered subscribers u can enter the draw 4 a 100 G.B. gift voucher by replying with ENTER. To unsubscribe text STOP
2236,spam,3. You have received your mobile content. Enjoy
2237,spam,Want explicit SEX in 30 secs? Ring 02073162414 now! Costs 20p/min
2249,spam,"Latest Nokia Mobile or iPOD MP3 Player +£400 proze GUARANTEED! Reply with: WIN to 83355 now! Norcorp Ltd.£1,50/Mtmsgrcvd18+"
2258,spam,"Congrats! 2 mobile 3G Videophones R yours. call 09061744553 now! videochat wid ur mates, play java games, Dload polyH music, noline rentl. bx420. ip4. 5we. 150pm"
2263,spam,"I want some cock! My hubby's away, I need a real man 2 satisfy me. Txt WIFE to 89938 for no strings action. (Txt STOP 2 end, txt rec £1.50ea. OTBox 731 LA1 7WS. )"
2271,spam,FreeMsg Hi baby wow just got a new cam moby. Wanna C a hot pic? or Fancy a chat?Im w8in 4uTxt / rply CHAT to 82242 Hlp 08712317606 Msg150p 2rcv
2285,spam,Wanna have a laugh? Try CHIT-CHAT on your mobile now! Logon by txting the word: CHAT and send it to No: 8883 CM PO Box 4217 London W1A 6ZF 16+ 118p/msg rcvd
2288,spam,Congratulations ur awarded 500 of CD vouchers or 125gift guaranteed & Free entry 2 100 wkly draw txt MUSIC to 87066
2289,spam,"Urgent! call 09066350750 from your landline. Your complimentary 4* Ibiza Holiday or 10,000 cash await collection SAE T&Cs PO BOX 434 SK3 8WP 150 ppm 18+"
2293,spam,"Mila, age23, blonde, new in UK. I look sex with UK guys. if u like fun with me. Text MTALK to 69866.18 . 30pp/txt 1st 5free. £1.50 increments. Help08718728876"
2314,spam,Todays Voda numbers ending with 7634 are selected to receive a £350 reward. If you have a match please call 08712300220 quoting claim code 7684 standard rates apply.
2321,spam,You are being ripped off! Get your mobile content from www.clubmoby.com call 08717509990 poly/true/Pix/Ringtones/Games six downloads for only 3
2323,spam,We tried to contact you re your reply to our offer of a Video Phone 750 anytime any network mins Half Price Line Rental Camcorder Reply or call 08000930705
2336,spam,"Customer service announcement. We recently tried to make a delivery to you but were unable to do so, please call 07099833605 to re-schedule. Ref:9280114"
2350,spam,"WIN: We have a winner! Mr. T. Foley won an iPod! More exciting prizes soon, so keep an eye on ur mobile or visit www.win-82050.co.uk"
2362,spam,"FREE GAME. Get Rayman Golf 4 FREE from the O2 Games Arcade. 1st get UR games settings. Reply POST, then save & activ8. Press 0 key for Arcade. Termsapply"
2367,spam,Buy Space Invaders 4 a chance 2 win orig Arcade Game console. Press 0 for Games Arcade (std WAP charge) See o2.co.uk/games 4 Terms + settings. No purchase
2379,spam,URGENT! Your Mobile number has been awarded with a £2000 prize GUARANTEED. Call 09061790121 from land line. Claim 3030. Valid 12hrs only 150ppm
2398,spam,URGENT This is our 2nd attempt to contact U. Your £900 prize from YESTERDAY is still awaiting collection. To claim CALL NOW 09061702893
2410,spam,Check Out Choose Your Babe Videos @ sms.shsex.netUN fgkslpoPW fgkslpo
2411,spam,u r a winner U ave been specially selected 2 receive £1000 cash or a 4* holiday (flights inc) speak to a live operator 2 claim 0871277810710p/min (18 )
2420,spam,PRIVATE! Your 2003 Account Statement for shows 800 un-redeemed S. I. M. points. Call 08715203652 Identifier Code: 42810 Expires 29/10/0
2422,spam,YOU HAVE WON! As a valued Vodafone customer our computer has picked YOU to win a £150 prize. To collect is easy. Just call 09061743386 
2431,spam,**FREE MESSAGE**Thanks for using the Auction Subscription Service. 18 . 150p/MSGRCVD 2 Skip an Auction txt OUT. 2 Unsubscribe txt STOP CustomerCare 08718726270
2438,spam,lyricalladie(21/F) is inviting you to be her friend. Reply YES-910 or NO-910. See her: www.SMS.ac/u/hmmross STOP? Send STOP FRND to 62468
2439,spam,No 1 POLYPHONIC tone 4 ur mob every week! Just txt PT2 to 87575. 1st Tone FREE ! so get txtin now and tell ur friends. 150p/tone. 16 reply HL 4info
2450,spam,"ou are guaranteed the latest Nokia Phone, a 40GB iPod MP3 player or a £500 prize! Txt word: COLLECT to No: 83355! IBHltd LdnW15H 150p/Mtmsgrcvd18"
2451,spam,* FREE* POLYPHONIC RINGTONE Text SUPER to 87131 to get your FREE POLY TONE of the week now! 16 SN PoBox202 NR31 7ZS subscription 450pw
2465,spam,"Hi, the SEXYCHAT girls are waiting for you to text them. Text now for a great night chatting. send STOP to stop this service"
2474,spam,"Hi this is Amy, we will be sending you a free phone number in a couple of days, which will give you an access to all the adult parties..."
2476,spam,"Welcome to Select, an O2 service with added benefits. You can now call our specially trained advisors FREE from your mobile by dialling 402."
2482,spam,Dear Voucher holder Have your next meal on us. Use the following link on your pc 2 enjoy a 2 4 1 dining experiencehttp://www.vouch4me.com/etlp/dining.asp
2483,spam,URGENT! We are trying to contact U. Todays draw shows that you have won a £2000 prize GUARANTEED. Call 09058094507 from land line. Claim 3030. Valid 12hrs only
2492,spam,goldviking (29/M) is inviting you to be his friend. Reply YES-762 or NO-762 See him: www.SMS.ac/u/goldviking STOP? Send STOP FRND to 62468
2495,spam,Phony £350 award - Todays Voda numbers ending XXXX are selected to receive a £350 award. If you have a match please call 08712300220 quoting claim code 3100 standard rates app
2513,spam,Ur cash-balance is currently 500 pounds - to maximize ur cash-in now send GO to 86688 only 150p/meg. CC: 08718720201 HG/Suite342/2lands Row/W1j6HL
2518,spam,You won't believe it but it's true. It's Incredible Txts! Reply G now to learn truly amazing things that will blow your mind. From O2FWD only 18p/txt
2520,spam,Natalie (20/F) is inviting you to be her friend. Reply YES-165 or NO-165 See her: www.SMS.ac/u/natalie2k9 STOP? Send STOP FRND to 62468
2521,spam,Jamster! To get your free wallpaper text HEART to 88888 now! T&C apply. 16 only. Need Help? Call 08701213186.
2527,spam,Double Mins & Double Txt & 1/2 price Linerental on Latest Orange Bluetooth mobiles. Call MobileUpd8 for the very latest offers. 08000839402 or call2optout/LF56
2535,spam,5p 4 alfie Moon's Children in need song on ur mob. Tell ur m8s. Txt Tone charity to 8007 for Nokias or Poly charity for polys: zed 08701417012 profit 2 charity.
2536,spam,WIN a £200 Shopping spree every WEEK Starting NOW. 2 play text STORE to 88039. SkilGme. TsCs08714740323 1Winawk! age16 £1.50perweeksub.
2539,spam,Do you want a New Nokia 3510i colour phone DeliveredTomorrow? With 300 free minutes to any mobile + 100 free texts + Free Camcorder reply or call 08000930705.
2558,spam,"Get 3 Lions England tone, reply lionm 4 mono or lionp 4 poly. 4 more go 2 www.ringtones.co.uk, the original n best. Tones 3GBP network operator rates apply."
2569,spam,"YOU VE WON! Your 4* Costa Del Sol Holiday or £5000 await collection. Call 09050090044 Now toClaim. SAE, TC s, POBox334, Stockport, SK38xh, Cost£1.50/pm, Max10mins"
2571,spam,FREE for 1st week! No1 Nokia tone 4 ur mobile every week just txt NOKIA to 8077 Get txting and tell ur mates. www.getzed.co.uk POBox 36504 W45WQ 16+ norm150p/tone
