,category,message
2,spam,"FreeMsg Hey there darling it's been 3 week's now and no word back! I'd like some fun you up for it still? Tb ok! XxX std chgs to send, £1.50 to rcv"
4,spam,Had your mobile 11 months or more? U R entitled to Update to the latest colour mobiles with camera for Free! Call The Mobile Update Co FREE on 08002986030
5,spam,"SIX chances to win CASH! From 100 to 20,000 pounds txt> CSH11 and send to 87575. Cost 150p/day, 6days, 16+ TsandCs apply Reply HL 4 info"
7,spam,"XXXMobileMovieClub: To use your credit, click the WAP link in the next txt message or click here>> http://wap. xxxmobilemovieclub.com?n=QJKGIGHJJGCBL"
9,spam,"England v Macedonia - dont miss the goals/team news. Txt ur national team to 87077 eg ENGLAND to 87077 Try:WALES, SCOTLAND 4txt/ú1.20 POBOXox36504W45WQ 16+"
32,spam,"As a valued customer, I am pleased to advise you that following recent review of your Mob No. you are awarded with a £1500 Bonus Prize, call 09066364589"
33,spam,"Urgent UR awarded a complimentary trip to EuroDisinc Trav, Aco&Entry41 Or £1000. To claim txt DIS to 87121 18+6*£1.50(moreFrmMob. ShrAcomOrSglSuplt)10, LS1 3AJ"
46,spam,Please call our customer service representative on 0800 169 6031 between 10am-9pm as you have WON a guaranteed £1000 cash or £5000 prize!
47,spam,"Your free ringtone is waiting to be collected. Simply text the password ""MIX"" to 85069 to verify. Get Usher and Britney. FML, PO Box 5249, MK17 92H. 450Ppw 16"
58,spam,You are a winner U have been specially selected 2 receive £1000 or a 4* holiday (flights inc) speak to a live operator 2 claim 0871277810910p/min (18+) 
60,spam,"URGENT! Your Mobile No. was awarded £2000 Bonus Caller Prize on 5/9/03 This is our final try to contact U! Call from Landline 09064019788 BOX42WR29C, 150PPM"
61,spam,Todays Voda numbers ending 7548 are selected to receive a $350 award. If you have a match please call 08712300220 quoting claim code 4041 standard rates app
67,spam,Want 2 get laid tonight? Want real Dogging locations sent direct 2 ur mob? Join the UK's largest Dogging Network bt Txting GRAVEL to 69888! Nt. ec2a. 31p.msg@150p
69,spam,You'll not rcv any more msgs from the chat svc. For FREE Hardcore services text GO to: 69988 If u get nothing u must Age Verify with yr network & try again
73,spam,"FreeMsg Why haven't you replied to my text? I'm Randy, sexy, female and live local. Luv to hear from u. Netcollex Ltd 08700621170150p per msg reply Stop to end"
79,spam,Customer service annoncement. You have a New Years delivery waiting for you. Please call 07046744435 now to arrange delivery
82,spam,"BangBabes Ur order is on the way. U SHOULD receive a Service Msg 2 download UR content. If U do not, GoTo wap. bangb. tv on UR mobile internet/service menu"
83,spam,URGENT! We are trying to contact you. Last weekends draw shows that you have won a £900 prize GUARANTEED. Call 09061701939. Claim code S89. Valid 12hrs only
95,spam,Are you unique enough? Find out from 30th August. www.areyouunique.co.uk
112,spam,"500 New Mobiles from 2004, MUST GO! Txt: NOKIA to No: 89545 & collect yours today!From ONLY £1 www.4-tc.biz 2optout 087187262701.50gbp/mtmsg18"
113,spam,"Will u meet ur dream partner soon? Is ur career off 2 a flyng start? 2 find out free, txt HORO followed by ur star sign, e. g. HORO ARIES"
117,spam,Text & meet someone sexy today. U can find a date or even flirt its up to U. Join 4 just 10p. REPLY with NAME & AGE eg Sam 25. 18 -msg recd@thirtyeight pence
129,spam,We tried to contact you re your reply to our offer of a Video Handset? 750 anytime networks mins? UNLIMITED TEXT? Camcorder? Reply or call 08000930705 NOW
136,spam,HMV BONUS SPECIAL 500 pounds of genuine HMV vouchers to be won. Just answer 4 easy questions. Play Now! Send HMV to 86688 More info:www.100percent-real.com
152,spam,"SMS. ac Blind Date 4U!: Rodds1 is 21/m from Aberdeen, United Kingdom. Check Him out http://img. sms. ac/W/icmb3cktz8r7!-4 no Blind Dates send HIDE"
154,spam,"TheMob> Check out our newest selection of content, Games, Tones, Gossip, babes and sport, Keep your mobile fit and funky text WAP to 82468"
159,spam,December only! Had your mobile 11mths+? You are entitled to update to the latest colour camera mobile for Free! Call The Mobile Update Co FREE on 08002986906
166,spam,Call Germany for only 1 pence per minute! Call from a fixed line via access number 0844 861 85 85. No prepayment. Direct access!
167,spam,Valentines Day Special! Win over £1000 in our quiz and take your partner on the trip of a lifetime! Send GO to 83600 now. 150p/msg rcvd. CustCare:08718720201.
174,spam,Fancy a shag? I do.Interested? sextextuk.com txt XXUK SUZY to 69876. Txts cost 1.50 per msg. TnCs on website. X
178,spam,Congratulations ur awarded 500 of CD vouchers or 125gift guaranteed & Free entry 2 100 wkly draw txt MUSIC to 87066 TnCs www.Ldew.com1win150ppmx3age16
183,spam,"Update_Now - Xmas Offer! Latest Motorola, SonyEricsson & Nokia & FREE Bluetooth! Double Mins & 1000 Txt on Orange. Call MobileUpd8 on 08000839402 or call2optout/F4Q="
187,spam,"Thanks for your Ringtone Order, Reference T91. You will be charged GBP 4 per week. You can unsubscribe at anytime by calling customer services on 09057039994"
192,spam,"Double mins and txts 4 6months FREE Bluetooth on Orange. Available on Sony, Nokia Motorola phones. Call MobileUpd8 on 08000839402 or call2optout/N9DX"
194,spam,4mths half price Orange line rental & latest camera phones 4 FREE. Had your phone 11mths ? Call MobilesDirect free on 08000938767 to update now! or2stoptxt
200,spam,"FREE RINGTONE text FIRST to 87131 for a poly or text GET to 87131 for a true tone! Help? 0845 2814032 16 after 1st free, tones are 3x£150pw to e£nd txt stop"
207,spam,100 dating service cal;l 09064012103 box334sk38ch
216,spam,Congrats! Nokia 3650 video camera phone is your Call 09066382422 Calls cost 150ppm Ave call 3mins vary from mobiles 16+ Close 300603 post BCM4284 Ldn WC1N3XX
227,spam,"Loan for any purpose £500 - £75,000. Homeowners + Tenants welcome. Have you been previously refused? We can still help. Call Free 0800 1956669 or text back 'help'"
231,spam,"UpgrdCentre Orange customer, you may now claim your FREE CAMERA PHONE upgrade for your loyalty. Call now on 0207 153 9153. Offer ends 26th July. T&C's apply. Opt-out available"
235,spam,okmail: Dear Dave this is your final notice to collect your 4* Tenerife Holiday or #5000 CASH award! Call 09061743806 from landline. TCs SAE Box326 CW25WX 150ppm
243,spam,"FREE MESSAGE Activate your 500 FREE Text Messages by replying to this message with the word FREE For terms & conditions, visit www.07781482378.com"
252,spam,+123 Congratulations - in this week's competition draw u have won the £1450 prize to claim just call 09050002311 b4280703. T&Cs/stop SMS 08718727868. Over 18 only 150ppm
257,spam,"You are guaranteed the latest Nokia Phone, a 40GB iPod MP3 player or a £500 prize! Txt word: COLLECT to No: 83355! IBHltd LdnW15H 150p/Mtmsgrcvd18+"
258,spam,Boltblue tones for 150p Reply POLY# or MONO# eg POLY3 1. Cha Cha Slide 2. Yeah 3. Slow Jamz 6. Toxic 8. Come With Me or STOP 4 more tones txt MORE
262,spam,"URGENT!: Your Mobile No. was awarded a £2,000 Bonus Caller Prize on 02/09/03! This is our 2nd attempt to contact YOU! Call 0871-872-9755 BOX95QU"
263,spam,"Today's Offer! Claim ur £150 worth of discount vouchers! Text YES to 85023 now! SavaMob, member offers mobile! T Cs 08717898035. £3.00 Sub. 16 . Unsub reply X"
264,spam,You will recieve your tone within the next 24hrs. For Terms and conditions please see Channel U Teletext Pg 750
265,spam,PRIVATE! Your 2003 Account Statement for 07815296484 shows 800 un-redeemed S.I.M. points. Call 08718738001 Identifier Code 41782 Expires 18/11/04 
270,spam,from www.Applausestore.com MonthlySubscription@50p/msg max6/month T&CsC web age16 2stop txt stop
289,spam,"our mobile number has won £5000, to claim calls us back or ring the claims hot line on 09050005321."
291,spam,We tried to contact you re your reply to our offer of 750 mins 150 textand a new video phone call 08002988890 now or reply for free delivery tomorrow
295,spam,"For ur chance to win a £250 wkly shopping spree TXT: SHOP to 80878. T's&C's www.txt-2-shop.com custcare 08715705022, 1x150p/wk"
296,spam,PRIVATE! Your 2003 Account Statement for 07753741225 shows 800 un-redeemed S. I. M. points. Call 08715203677 Identifier Code: 42478 Expires 24/10/04
303,spam,XCLUSIVE@CLUBSAISAI 2MOROW 28/5 SOIREE SPECIALE ZOUK WITH NICHOLS FROM PARIS.FREE ROSES 2 ALL LADIES !!! info: 07946746291/07880867867 
305,spam,22 days to kick off! For Euro2004 U will be kept up to date with the latest news and results daily. To be removed send GET TXT STOP to 83222
314,spam,New TEXTBUDDY Chat 2 horny guys in ur area 4 just 25p Free 2 receive Search postcode or at gaytextbuddy.com. TXT ONE name to 89693
317,spam,"Dear Voucher Holder, 2 claim this weeks offer, at your PC go to http://www.e-tlp.co.uk/expressoffer Ts&Cs apply.2 stop texts txt STOP to 80062."
336,spam,Get ur 1st RINGTONE FREE NOW! Reply to this msg with TONE. Gr8 TOP 20 tones to your phone every week just £1.50 per wk 2 opt out send STOP 08452810071 16
354,spam,"To review and KEEP the fantastic Nokia N-Gage game deck with Club Nokia, go 2 www.cnupdates.com/newsletter. unsubscribe from alerts reply with the word OUT"
356,spam,08714712388 between 10am-7pm Cost 10p
358,spam,+449071512431 URGENT! This is the 2nd attempt to contact U!U have WON £1250 CALL 09071512433 b4 050703 T&CsBCM4235WC1N3XX. callcost 150ppm mobilesvary. max£7. 50
359,spam,You have WON a guaranteed £1000 cash or a £2000 prize. To claim yr prize call our customer service representative on 08714712394 between 10am-7pm
365,spam,Email AlertFrom: Jeri StewartSize: 2KBSubject: Low-cost prescripiton drvgsTo listen to email call 123
375,spam,"Do you realize that in about 40 years, we'll have thousands of old ladies running around with tattoos?"
380,spam,"Romantic Paris. 2 nights, 2 flights from £79 Book now 4 next year. Call 08704439680Ts&Cs apply."
381,spam,Urgent Ur £500 guaranteed award is still unclaimed! Call 09066368327 NOW closingdate04/09/02 claimcode M39M51 £1.50pmmorefrommobile2Bremoved-MobyPOBox734LS27YF
394,spam,"5 Free Top Polyphonic Tones call 087018728737, National Rate. Get a toppoly tune sent every week, just text SUBPOLY to 81618, £3 per pole. UnSub 08718727870."
398,spam,"Orange customer, you may now claim your FREE CAMERA PHONE upgrade for your loyalty. Call now on 0207 153 9996. Offer ends 14thMarch. T&C's apply. Opt-out availa"
400,spam,"Last Chance! Claim ur £150 worth of discount vouchers today! Text SHOP to 85023 now! SavaMob, offers mobile! T Cs SavaMob POBOX84, M263UZ. £3.00 Sub. 16"
401,spam,FREE for 1st week! No1 Nokia tone 4 ur mobile every week just txt NOKIA to 8077 Get txting and tell ur mates. www.getzed.co.uk POBox 36504 W45WQ 16+ norm150p/tone
406,spam,Congratulations ur awarded either £500 of CD gift vouchers & Free entry 2 our £100 weekly draw txt MUSIC to 87066 TnCs www.Ldew.com1win150ppmx3age16
407,spam,"U were outbid by simonwatson5120 on the Shinco DVD Plyr. 2 bid again, visit sms. ac/smsrewards 2 end bid notifications, reply END OUT"
411,spam,"SMSSERVICES. for yourinclusive text credits, pls goto www.comuk.net login= 3qxj9 unsubscribe with STOP, no extra charge. help 08702840625.COMUK. 220-CM2 9AE"
415,spam,U have a secret admirer. REVEAL who thinks U R So special. Call 09065174042. To opt out Reply REVEAL STOP. 1.50 per msg recd. Cust care 07821230901
416,spam,"Dear Voucher Holder, To claim this weeks offer, at you PC please go to http://www.e-tlp.co.uk/expressoffer Ts&Cs apply. To stop texts, txt STOP to 80062"
418,spam,Do you want 750 anytime any network mins 150 text and a NEW VIDEO phone for only five pounds per week call 08002888812 or reply for delivery tomorrow
419,spam,We tried to contact you re our offer of New Video Phone 750 anytime any network mins HALF PRICE Rental camcorder call 08000930705 or reply for delivery Wed
434,spam,Hello. We need some posh birds and chaps to user trial prods for champneys. Can i put you down? I need your address and dob asap. Ta r
439,spam,U have a secret admirer who is looking 2 make contact with U-find out who they R*reveal who thinks UR so special-call on 09058094565
440,spam,Reminder: You have not downloaded the content you have already paid for. Goto http://doit. mymoby. tv/ to collect your content.
453,spam,"all the lastest from Stereophonics, Marley, Dizzee Racal, Libertines and The Strokes! Win Nookii games with Flirt!! Click TheMob WAP Bookmark or text WAP to 82468"
467,spam,"Dear Matthew please call 09063440451 from a landline, your complimentary 4*Lux Tenerife holiday or £1000 CASH await collection. ppm150 SAE T&Cs Box334 SK38XH."
469,spam,"Urgent! call 09061749602 from Landline. Your complimentary 4* Tenerife Holiday or £10,000 cash await collection SAE T&Cs BOX 528 HP20 1YF 150ppm 18+"
471,spam,How about getting in touch with folks waiting for company? Just txt back your NAME and AGE to opt in! Enjoy the community (150p/SMS)
473,spam,Ur cash-balance is currently 500 pounds - to maximize ur cash-in now send GO to 86688 only 150p/msg. CC: 08718720201 PO BOX 114/14 TCR/W1
477,spam,Filthy stories and GIRLS waiting for your
491,spam,"Congrats! 2 mobile 3G Videophones R yours. call 09063458130 now! videochat wid your mates, play java games, Dload polyPH music, noline rentl."
503,spam,Panasonic & BluetoothHdset FREE. Nokia FREE. Motorola FREE & DoubleMins & DoubleTxt on Orange contract. Call MobileUpd8 on 08000839402 or call 2optout
508,spam,FREE for 1st week! No1 Nokia tone 4 ur mob every week just txt NOKIA to 8007 Get txting and tell ur mates www.getzed.co.uk POBox 36504 W45WQ norm150p/tone 16+
522,spam,"We know someone who you know that fancies you. Call 09058097218 to find out who. POBox 6, LS15HB 150p"
534,spam,Someone U know has asked our dating service 2 contact you! Cant Guess who? CALL 09058091854 NOW all will be revealed. PO BOX385 M6 6WU
536,spam,Dear U've been invited to XCHAT. This is our final attempt to contact u! Txt CHAT to 86688
544,spam,You are awarded a SiPix Digital Camera! call 09061221061 from landline. Delivery within 28days. T Cs Box177. M221BP. 2yr warranty. 150ppm. 16 . p p£3.99
545,spam,WIN URGENT! Your mobile number has been awarded with a £2000 prize GUARANTEED call 09061790121 from land line. claim 3030 valid 12hrs only 150ppm 
548,spam,Dear Subscriber ur draw 4 £100 gift voucher will b entered on receipt of a correct ans. When was Elvis Presleys Birthday? TXT answer to 80062
552,spam,Message Important information for O2 user. Today is your lucky day! 2 find out why log onto http://www.urawinner.com there is a fantastic surprise awaiting you
564,spam,Ur HMV Quiz cash-balance is currently £500 - to maximize ur cash-in now send HMV1 to 86688 only 150p/msg
568,spam,Dont forget you can place as many FREE Requests with 1stchoice.co.uk as you wish. For more Information call 08707808226.
581,spam,Free entry in 2 a wkly comp to win FA Cup final tkts 21st May 2005. Text FA to 87121 to receive entry question(std txt rate)T&C's apply 08452810075over18's
602,spam,WIN a year supply of CDs 4 a store of ur choice worth £500 & enter our £100 Weekly draw txt MUSIC to 87066 Ts&Cs www.Ldew.com.subs16+1win150ppmx3
603,spam,"As a SIM subscriber, you are selected to receive a Bonus! Get it delivered to your door, Txt the word OK to No: 88600 to claim. 150p/msg, EXP. 30Apr"
608,spam,You have 1 new voicemail. Please call 08719181513.
610,spam,No. 1 Nokia Tone 4 ur mob every week! Just txt NOK to 87021. 1st Tone FREE ! so get txtin now and tell ur friends. 150p/tone. 16 reply HL 4info
612,spam,You are a winner U have been specially selected 2 receive £1000 cash or a 4* holiday (flights inc) speak to a live operator 2 claim 0871277810810
613,spam,Reply with your name and address and YOU WILL RECEIVE BY POST a weeks completely free accommodation at various global locations www.phb1.com ph:08700435505150p
614,spam,FREE entry into our £250 weekly comp just send the word ENTER to 84128 NOW. 18 T&C www.textcomp.com cust care 08712405020.
631,spam,"Hungry gay guys feeling hungry and up 4 it, now. Call 08718730555 just 10p/min. To stop texts call 08712460324 (10p/min)"
634,spam,Can U get 2 phone NOW? I wanna chat 2 set up meet Call me NOW on 09096102316 U can cum here 2moro Luv JANE xx Calls£1/minmoremobsEMSPOBox45PO139WA
653,spam,Enjoy the jamster videosound gold club with your credits for 2 new videosounds+2 logos+musicnews! get more fun from jamster.co.uk! 16+only Help? call: 09701213186 
687,spam,"500 New Mobiles from 2004, MUST GO! Txt: NOKIA to No: 89545 & collect yours today!From ONLY £1 www.4-tc.biz 2optout 087187262701.50gbp/mtmsg18 TXTAUCTION"
703,spam,"URGENT, IMPORTANT INFORMATION FOR O2 USER. TODAY IS YOUR LUCKY DAY! 2 FIND OUT WHY LOG ONTO HTTP://WWW.URAWINNER.COM THERE IS A FANTASTIC SURPRISE AWAITING FOR YOU"
711,spam,Congratulations ur awarded either £500 of CD gift vouchers & Free entry 2 our £100 weekly draw txt MUSIC to 87066 TnCs www.Ldew.com 1 win150ppmx3age16
724,spam,As a registered optin subscriber ur draw 4 £100 gift voucher will be entered on receipt of a correct ans to 80062 Whats No1 in the BBC charts
731,spam,"09066362231 URGENT! Your mobile No 07xxxxxxxxx won a £2,000 bonus caller prize on 02/06/03! this is the 2nd attempt to reach YOU! call 09066362231 ASAP!"
734,spam,Hi its LUCY Hubby at meetins all day Fri & I will B alone at hotel U fancy cumin over? Pls leave msg 2day 09099726395 Lucy x Calls£1/minMobsmoreLKPOBOX177HP51FL
753,spam,Thanks for the Vote. Now sing along with the stars with Karaoke on your mobile. For a FREE link just reply with SING now.
760,spam,"URGENT! Your Mobile No was awarded a £2,000 Bonus Caller Prize on 1/08/03! This is our 2nd attempt to contact YOU! Call 0871-4719-523 BOX95QU BT National Rate"
786,spam,Ur cash-balance is currently 500 pounds - to maximize ur cash-in now send GO to 86688 only 150p/msg. CC 08718720201 HG/Suite342/2Lands Row/W1J6HL
798,spam,As a Registered Subscriber yr draw 4 a £100 gift voucher will b entered on receipt of a correct ans. When are the next olympics. Txt ans to 80062
806,spam,RT-KIng Pro Video Club>> Need help? info@ringtoneking.co.uk or call 08701237397 You must be 16+ Club credits redeemable at www.ringtoneking.co.uk! Enjoy!
811,spam,U have a secret admirer who is looking 2 make contact with U-find out who they R*reveal who thinks UR so special-call on 09058094599
812,spam,500 free text msgs. Just text ok to 80488 and we'll credit your account
817,spam,"Eerie Nokia tones 4u, rply TONE TITLE to 8007 eg TONE DRACULA to 8007 Titles: GHOST, ADDAMSFA, MUNSTERS, EXORCIST, TWILIGHT www.getzed.co.uk POBox36504W45WQ 150p"
826,spam,"For ur chance to win a £250 cash every wk TXT: ACTION to 80608. T's&C's www.movietrivia.tv custcare 08712405022, 1x150p/wk"
829,spam,RGENT! This is the 2nd attempt to contact U!U have WON £1250 CALL 09071512433 b4 050703 T&CsBCM4235WC1N3XX. callcost 150ppm mobilesvary. max£7. 50
831,spam,Hi if ur lookin 4 saucy daytime fun wiv busty married woman Am free all next week Chat now 2 sort time 09099726429 JANINExx Calls£1/minMobsmoreLKPOBOX177HP51FL
836,spam,URGENT! We are trying to contact U. Todays draw shows that you have won a £800 prize GUARANTEED. Call 09050001295 from land line. Claim A21. Valid 12hrs only
843,spam,todays vodafone numbers ending with 0089(my last four digits) are selected to received a £350 award. If your number matches please call 09063442151 to claim your £350 award
845,spam,Sunshine Quiz Wkly Q! Win a top Sony DVD player if u know which country the Algarve is in? Txt ansr to 82277. £1.50 SP:Tyrone
849,spam,"Free msg. Sorry, a service you ordered from 81303 could not be delivered as you do not have sufficient credit. Please top up to receive the service."
870,spam,UR GOING 2 BAHAMAS! CallFREEFONE 08081560665 and speak to a live operator to claim either Bahamas cruise of£2000 CASH 18+only. To opt out txt X to 07786200117
872,spam,Someone has conacted our dating service and entered your phone because they fancy you!To find out who it is call from landline 09111030116. PoBox12n146tf15
882,spam,Hi 07734396839 IBH Customer Loyalty Offer: The NEW NOKIA6600 Mobile from ONLY £10 at TXTAUCTION!Txt word:START to No:81151 & get Yours Now!4T&
883,spam,SMS AUCTION You have won a Nokia 7250i. This is what you get when you win our FREE auction. To take part send Nokia to 86021 now. HG/Suite342/2Lands Row/W1JHL 16+
888,spam,Call FREEPHONE 0800 542 0578 now!
890,spam,BIG BROTHER ALERT! The computer has selected u for 10k cash or #150 voucher. Call 09064018838. NTT PO Box CRO1327 18+ BT Landline Cost 150ppm mobiles vary
896,spam,"WIN: We have a winner! Mr. T. Foley won an iPod! More exciting prizes soon, so keep an eye on ur mobile or visit www.win-82050.co.uk"
903,spam,Todays Voda numbers ending 1225 are selected to receive a £50award. If you have a match please call 08712300220 quoting claim code 3100 standard rates app 
919,spam,"Hack Chat. Get backdoor entry into 121 chat rooms at a fraction of the cost. Reply NEO69 or call 09050280520, to subscribe 25p pm. DPS, Bcm box 8027 Ldn, wc1n3xx"
926,spam,"This is the 2nd time we have tried 2 contact u. U have won the 750 Pound prize. 2 claim is easy, call 08718726970 NOW! Only 10p per min. BT-national-rate "
937,spam,Would you like to see my XXX pics they are so hot they were nearly banned in the uk!
943,spam,Dear 0776xxxxxxx U've been invited to XCHAT. This is our final attempt to contact u! Txt CHAT to 86688 150p/MsgrcvdHG/Suite342/2Lands/Row/W1J6HL LDN 18yrs 
946,spam,CALL 09090900040 & LISTEN TO EXTREME DIRTY LIVE CHAT GOING ON IN THE OFFICE RIGHT NOW TOTAL PRIVACY NO ONE KNOWS YOUR [sic] LISTENING 60P MIN 24/7MP 0870753331018+
947,spam,"FreeMsg Hey U, i just got 1 of these video/pic fones, reply WILD to this txt & ill send U my pics, hurry up Im so bored at work xxx (18 150p/rcvd STOP2stop)"
957,spam,New TEXTBUDDY Chat 2 horny guys in ur area 4 just 25p Free 2 receive Search postcode or at gaytextbuddy.com. TXT ONE name to 89693. 08715500022 rpl Stop 2 cnl
964,spam,Call from 08702490080 - tells u 2 call 09066358152 to claim £5000 prize. U have 2 enter all ur mobile & personal details @ the prompts. Careful!
980,spam,Guess what! Somebody you know secretly fancies you! Wanna find out who it is? Give us a call on 09065394973 from Landline DATEBox1282EssexCM61XN 150p/min 18
981,spam,it to 80488. Your 500 free text messages are valid until 31 December 2005.
992,spam,Urgent! Please call 09061743810 from landline. Your ABTA complimentary 4* Tenerife Holiday or #5000 cash await collection SAE T&Cs Box 326 CW25WX 150 ppm
996,spam,Free tones Hope you enjoyed your new content. text stop to 61610 to unsubscribe. help:08712400602450p Provided by tones2you.co.uk
1001,spam,TheMob>Yo yo yo-Here comes a new selection of hot downloads for our members to get for FREE! Just click & open the next link sent to ur fone...
1011,spam,"U can WIN £100 of Music Gift Vouchers every week starting NOW Txt the word DRAW to 87066 TsCs www.ldew.com SkillGame,1Winaweek, age16.150ppermessSubscription"
1026,spam,"Call 09094100151 to use ur mins! Calls cast 10p/min (mob vary). Service provided by AOM, just GBP5/month. AOM Box61,M60 1ER until u stop. Ages 18+ only!"
1035,spam,Sexy Singles are waiting for you! Text your AGE followed by your GENDER as wither M or F E.G.23F. For gay men text your AGE followed by a G. e.g.23G.
1039,spam,85233 FREE>Ringtone!Reply REAL
1044,spam,Well done ENGLAND! Get the official poly ringtone or colour flag on yer mobile! text TONE or FLAG to 84199 NOW! Opt-out txt ENG STOP. Box39822 W111WX £1.50
1047,spam,PRIVATE! Your 2004 Account Statement for 07742676969 shows 786 unredeemed Bonus Points. To claim call 08719180248 Identifier Code: 45239 Expires
1054,spam,"FREE2DAY sexy St George's Day pic of Jordan!Txt PIC to 89080 dont miss out, then every wk a saucy celeb!4 more pics c PocketBabe.co.uk 0870241182716 £3/wk"
1056,spam,You are a winner you have been specially selected to receive £1000 cash or a £2000 award. Speak to a live operator to claim call 087123002209am-7pm. Cost 10p
1057,spam,"Sunshine Hols. To claim ur med holiday send a stamped self address envelope to Drinks on Us UK, PO Box 113, Bray, Wicklow, Eire. Quiz Starts Saturday! Unsub Stop"
1059,spam,"U can WIN £100 of Music Gift Vouchers every week starting NOW Txt the word DRAW to 87066 TsCs www.Idew.com SkillGame, 1Winaweek, age16. 150ppermessSubscription"
1066,spam,Your B4U voucher w/c 27/03 is MARSMS. Log onto www.B4Utele.com for discount credit. To opt out reply stop. Customer care call 08717168528
1072,spam,FreeMsg: Hey - I'm Buffy. 25 and love to satisfy men. Home alone feeling randy. Reply 2 C my PIX! QlynnBV Help08700621170150p a msg Send stop to stop txts
1094,spam,FREE camera phones with linerental from 4.49/month with 750 cross ntwk mins. 1/2 price txt bundle deals also avble. Call 08001950382 or call2optout/J MF
1103,spam,"URGENT! Your mobile No 07xxxxxxxxx won a £2,000 bonus caller prize on 02/06/03! this is the 2nd attempt to reach YOU! call 09066362231 ASAP! BOX97N7QP, 150PPM"
1104,spam,"URGENT!! Your 4* Costa Del Sol Holiday or £5000 await collection. Call 09050090044 Now toClaim. SAE, TC s, POBox334, Stockport, SK38xh, Cost£1.50/pm, Max10mins"
1123,spam,"Hi ya babe x u 4goten bout me?' scammers getting smart..Though this is a regular vodafone no, if you respond you get further prem rate msg/subscription. Other nos used also. Beware!"
1130,spam,SplashMobile: Choose from 1000s of gr8 tones each wk! This is a subscrition service with weekly tones costing 300p. U have one credit - kick back and ENJOY
1133,spam,<Forwarded from 88877>FREE entry into our £250 weekly comp just send the word ENTER to 88877 NOW. 18 T&C www.textcomp.com
1134,spam,88066 FROM 88066 LOST 3POUND HELP
1147,spam,You have 1 new message. Please call 08718738034.
