,category,message
275,ham,Carlos'll be here in a minute if you still need to buy
276,ham,Have a good evening! Ttyl
277,ham,Ho ho - big belly laugh! See ya tomo
278,ham,"I've got  &lt;#&gt; , any way I could pick up?"
279,ham,Maybe?! Say hi to  and find out if  got his card. Great escape or wetherspoons? 
280,ham,Cause I'm not freaky lol
281,ham,What is this 'hex' place you talk of? Explain!
282,ham,Is xy going 4 e lunch?
283,ham,I wanted to ask ü to wait 4 me to finish lect. Cos my lect finishes in an hour anyway.
284,ham,"Every King Was Once A Crying Baby And Every Great Building Was Once A Map.. Not Imprtant Where U r TODAY, BUT Where U Wil Reach TOMORW. Gud ni8"
285,ham,Thanks love. But am i doing torch or bold.
286,ham,Was the farm open?
287,ham,"My sister in law, hope you are having a great month. Just saying hey. Abiola"
288,ham,Ah poop. Looks like ill prob have to send in my laptop to get fixed cuz it has a gpu problem
289,ham,"Aight, you close by or still down around alex's place?"
290,ham,Mum ask ü to buy food home...
291,ham,How much r ü willing to pay?
292,ham,What is important is that you prevent dehydration by giving her enough fluids
293,ham,True dear..i sat to pray evening and felt so.so i sms'd you in some time...
294,ham,So when do you wanna gym harri
295,ham,"Height of Confidence: All the Aeronautics professors wer calld &amp; they wer askd 2 sit in an aeroplane. Aftr they sat they wer told dat the plane ws made by their students. Dey all hurried out of d plane.. Bt only 1 didnt move... He said:""if it is made by my students,this wont even start........ Datz confidence.."
296,ham,He also knows about lunch menu only da. . I know
297,ham,Oh is it? Send me the address
298,ham,That is wondar full flim.
299,ham,"The world is running and i am still.maybe all are feeling the same,so be it.or i have to admit,i am mad.then where is the correction?or let me call this is life.and keep running with the world,may be u r also running.lets run."
300,ham,Of cos can lar i'm not so ba dao ok... 1 pm lor... Y u never ask where we go ah... I said u would ask on fri but he said u will ask today...
301,ham,Exactly. Anyways how far. Is jide her to study or just visiting
302,ham,Lol you won't feel bad when I use her money to take you out to a steak dinner =D
303,ham,Leaving to qatar tonite in search of an opportunity.all went fast.pls add me in ur prayers dear.Rakhesh
304,ham,Thanks for looking out for me. I really appreciate.
305,ham,Wish i were with you now!
306,ham,Yes i will be there. Glad you made it.
307,ham,Just got up. have to be out of the room very soon. …. i hadn't put the clocks back til at 8 i shouted at everyone to get up and then realised it was 7. wahay. another hour in bed.
308,ham,Men like shorter ladies. Gaze up into his eyes.
309,ham,"I promise to take good care of you, princess. I have to run now. Please send pics when you get a chance. Ttyl!"
310,ham,Is there a reason we've not spoken this year? Anyways have a great week and all the best in your exam
311,ham,Dont gimme that lip caveboy
312,ham,Realy sorry-i don't recognise this number and am now confused :) who r u please?! 
313,ham,Cant think of anyone with * spare room off * top of my head
314,ham,U should have made an appointment
315,ham,"Wishing you and your family Merry ""X"" mas and HAPPY NEW Year in advance.."
316,ham,"I'm nt goin, got somethin on, unless they meetin 4 dinner lor... Haha, i wonder who will go tis time..."
317,ham,I cant pick the phone right now. Pls send a message
318,ham,Not getting anywhere with this damn job hunting over here!
319,ham,"idc get over here, you are not weaseling your way out of this shit twice in a row"
320,ham,Just sleeping..and surfing
321,ham,Why don't you go tell your friend you're not sure you want to live with him because he smokes too much then spend hours begging him to come smoke
322,ham,Happy New year my dear brother. I really do miss you. Just got your number and decided to send you this text wishing you only happiness. Abiola
323,ham,Your opinion about me? 1. Over 2. Jada 3. Kusruthi 4. Lovable 5. Silent 6. Spl character 7. Not matured 8. Stylish 9. Simple Pls reply..
324,ham,Beerage?
325,ham,Dont think so. It turns off like randomlly within 5min of opening
326,ham,It does it on its own. Most of the time it fixes my spelling. But sometimes it gets a completely diff word. Go figure
327,ham,This is hoping you enjoyed your game yesterday. Sorry i've not been in touch but pls know that you are fondly bein thot off. Have a great week. Abiola
328,ham,Y?WHERE U AT DOGBREATH? ITS JUST SOUNDING LIKE JAN C THATS AL!!!!!!!!!
329,ham,There generally isn't one. It's an uncountable noun - u in the dictionary. pieces of research?
330,ham,Ok i msg u b4 i leave my house.
331,ham,K I'll be there before 4.
332,ham,"sure, but make sure he knows we ain't smokin yet"
333,ham,I am taking half day leave bec i am not well
334,ham,S:)s.nervous  &lt;#&gt; :)
335,ham,"He has lots of used ones babe, but the model doesn't help. Youi have to bring it over and he'll match it up"
336,ham,Then why you not responding
337,ham,Good afternoon starshine! How's my boytoy? Does he crave me yet? Ache to fuck me ? *sips cappuccino* I miss you babe *teasing kiss*
338,ham,Have a good evening! Ttyl
339,ham,Hahaha..use your brain dear
340,ham,"Sorry light turned green, I meant another friend wanted  &lt;#&gt;  worth but he may not be around"
341,ham,Surely result will offer:)
342,ham,I luv u soo much u dont understand how special u r 2 me ring u 2morrow luv u xxx
343,ham,Our Prashanthettan's mother passed away last night. pray for her and family.
344,ham,K.k:)when are you going?
345,ham,My stomach has been thru so much trauma I swear I just can't eat. I better lose weight.
346,ham,"Yeah there's barely enough room for the two of us, x has too many fucking shoes. Sorry man, see you later"
347,ham,U reach orchard already? U wan 2 go buy tickets first?
348,ham,No da if you run that it activate the full version da.
349,ham,Stop the story. I've told him i've returned it and he's saying i should not re order it.
350,ham,Going to take your babe out ?
351,ham,Spoons it is then okay?
352,ham,In work now. Going have in few min.
353,ham,"Sorry, I guess whenever I can get a hold of my connections, maybe an hour or two? I'll text you"
354,ham,Dude ive been seeing a lotta corvettes lately
355,ham,"Same here, but I consider walls and bunkers and shit important just because I never play on peaceful but I guess your place is high enough that it don't matter"
356,ham,"Well am officially in a philosophical hole, so if u wanna call am at home ready to be saved!"
357,ham,I'll text you when I drop x off
358,ham,Talk With Yourself Atleast Once In A Day...!!! Otherwise You Will Miss Your Best FRIEND In This WORLD...!!! -Shakespeare- SHESIL  &lt;#&gt;
359,ham,Are you in castor? You need to see something
360,ham,I love to give massages. I use lots of baby oil... What is your fave position?
361,ham,Yoyyooo u know how to change permissions for a drive in mac. My usb flash drive
362,ham,I like to talk pa but am not able to. I dont know y.
363,ham,You unbelievable faglord
364,ham,Why do you ask princess?
